{
  "$schema": "runtime-api.schema.json",
  "language": "AuroraScript",
  "versionTarget": "2.1.1",
  "globals": {
    "Array": { "kind": "constructor" },
    "String": { "kind": "constructor" },
    "Boolean": { "kind": "constructor" },
    "Object": { "kind": "constructor" },
    "Number": { "kind": "constructor" },
    "Date": { "kind": "constructor" },
    "Error": { "kind": "constructor" },
    "HashMap": { "kind": "constructor" },
    "Regex": { "kind": "constructor" },
    "Proxy": { "kind": "constructor" },
    "StringBuffer": { "kind": "constructor", "notes": ["Use for high-volume incremental string building."] },
    "console": {
      "kind": "object",
      "members": {
        "log": { "kind": "method", "parameters": [{ "name": "values", "type": "any", "variadic": true }], "returns": "null" },
        "error": { "kind": "method", "parameters": [{ "name": "values", "type": "any", "variadic": true }], "returns": "null" },
        "time": { "kind": "method", "parameters": [{ "name": "label", "type": "string" }], "returns": "null" },
        "timeEnd": { "kind": "method", "parameters": [{ "name": "label", "type": "string" }], "returns": "null" }
      }
    },
    "JSON": {
      "kind": "object",
      "members": {
        "parse": { "kind": "method", "parameters": [{ "name": "text", "type": "string" }], "returns": "any" },
        "stringify": { "kind": "method", "parameters": [{ "name": "value", "type": "any" }, { "name": "indented", "type": "boolean", "optional": true }], "returns": "string" }
      }
    },
    "Math": {
      "kind": "object",
      "members": {
        "PI": { "kind": "constant", "returns": "number" },
        "E": { "kind": "constant", "returns": "number" },
        "Tau": { "kind": "constant", "returns": "number" },
        "DEG_PER_RAD": { "kind": "constant", "returns": "number" },
        "abs": { "kind": "method", "parameters": [{ "name": "value", "type": "number" }], "returns": "number" },
        "max": { "kind": "method", "parameters": [{ "name": "values", "type": "number", "variadic": true }], "returns": "number" },
        "min": { "kind": "method", "parameters": [{ "name": "values", "type": "number", "variadic": true }], "returns": "number" },
        "random": { "kind": "method", "parameters": [], "returns": "number" },
        "log": { "kind": "method", "parameters": [{ "name": "value", "type": "number" }], "returns": "number" },
        "pow": { "kind": "method", "parameters": [{ "name": "x", "type": "number" }, { "name": "y", "type": "number" }], "returns": "number" },
        "exp": { "kind": "method", "parameters": [{ "name": "value", "type": "number" }], "returns": "number" },
        "cos": { "kind": "method", "parameters": [{ "name": "value", "type": "number" }], "returns": "number" },
        "sin": { "kind": "method", "parameters": [{ "name": "value", "type": "number" }], "returns": "number" },
        "tan": { "kind": "method", "parameters": [{ "name": "value", "type": "number" }], "returns": "number" },
        "acos": { "kind": "method", "parameters": [{ "name": "value", "type": "number" }], "returns": "number" },
        "asin": { "kind": "method", "parameters": [{ "name": "value", "type": "number" }], "returns": "number" },
        "atan": { "kind": "method", "parameters": [{ "name": "value", "type": "number" }], "returns": "number" },
        "floor": { "kind": "method", "parameters": [{ "name": "value", "type": "number" }], "returns": "number" },
        "round": { "kind": "method", "parameters": [{ "name": "value", "type": "number" }], "returns": "number" }
      }
    },
    "HotPatch": {
      "kind": "object",
      "members": {
        "replace": { "kind": "method", "parameters": [{ "name": "modulePath", "type": "string" }, { "name": "script", "type": "string" }, { "name": "ignoreDepends", "type": "boolean", "optional": true }], "returns": "null" },
        "incremental": { "kind": "method", "parameters": [{ "name": "modulePath", "type": "string" }, { "name": "script", "type": "string" }, { "name": "ignoreDepends", "type": "boolean", "optional": true }], "returns": "null" }
      }
    }
  },
  "prototypes": {
    "Object": {
      "toString": { "kind": "method", "parameters": [], "returns": "string" },
      "length": { "kind": "property", "returns": "number" }
    },
    "Array": {
      "has": { "kind": "method", "parameters": [{ "name": "value", "type": "any" }], "returns": "boolean" },
      "indexOf": { "kind": "method", "parameters": [{ "name": "value", "type": "any" }], "returns": "number" },
      "lastIndexOf": { "kind": "method", "parameters": [{ "name": "value", "type": "any" }], "returns": "number" },
      "length": { "kind": "property", "returns": "number" },
      "push": { "kind": "method", "parameters": [{ "name": "values", "type": "any", "variadic": true }], "returns": "number" },
      "pop": { "kind": "method", "parameters": [], "returns": "any" },
      "sort": { "kind": "method", "parameters": [], "returns": "array" },
      "join": { "kind": "method", "parameters": [{ "name": "separator", "type": "string", "optional": true }], "returns": "string" },
      "slice": { "kind": "method", "parameters": [{ "name": "start", "type": "number" }, { "name": "end", "type": "number", "optional": true }], "returns": "array" },
      "reverse": { "kind": "method", "parameters": [], "returns": "array" },
      "unshift": { "kind": "method", "parameters": [{ "name": "values", "type": "any", "variadic": true }], "returns": "number" },
      "shift": { "kind": "method", "parameters": [], "returns": "any" },
      "concat": { "kind": "method", "parameters": [{ "name": "values", "type": "any", "variadic": true }], "returns": "array" },
      "find": { "kind": "method", "parameters": [{ "name": "callback", "type": "function" }], "returns": "any" },
      "findIndex": { "kind": "method", "parameters": [{ "name": "callback", "type": "function" }], "returns": "number" },
      "findLast": { "kind": "method", "parameters": [{ "name": "callback", "type": "function" }], "returns": "any" },
      "findLastIndex": { "kind": "method", "parameters": [{ "name": "callback", "type": "function" }], "returns": "number" },
      "map": { "kind": "method", "parameters": [{ "name": "callback", "type": "function" }], "returns": "array" },
      "filter": { "kind": "method", "parameters": [{ "name": "callback", "type": "function" }], "returns": "array" },
      "some": { "kind": "method", "parameters": [{ "name": "callback", "type": "function" }], "returns": "boolean" },
      "every": { "kind": "method", "parameters": [{ "name": "callback", "type": "function" }], "returns": "boolean" },
      "flat": { "kind": "method", "parameters": [], "returns": "array" },
      "reduce": { "kind": "method", "parameters": [{ "name": "callback", "type": "function" }, { "name": "initial", "type": "any", "optional": true }], "returns": "any" }
    },
    "String": {
      "length": { "kind": "property", "returns": "number" },
      "contains": { "kind": "method", "parameters": [{ "name": "value", "type": "string" }], "returns": "boolean" },
      "indexOf": { "kind": "method", "parameters": [{ "name": "value", "type": "string" }], "returns": "number" },
      "lastIndexOf": { "kind": "method", "parameters": [{ "name": "value", "type": "string" }], "returns": "number" },
      "startsWith": { "kind": "method", "parameters": [{ "name": "value", "type": "string" }], "returns": "boolean" },
      "endsWith": { "kind": "method", "parameters": [{ "name": "value", "type": "string" }], "returns": "boolean" },
      "substring": { "kind": "method", "parameters": [{ "name": "start", "type": "number" }, { "name": "lengthOrEnd", "type": "number", "optional": true }], "returns": "string" },
      "split": { "kind": "method", "parameters": [{ "name": "separator", "type": "string|regex" }], "returns": "array" },
      "match": { "kind": "method", "parameters": [{ "name": "pattern", "type": "regex|string" }], "returns": "any" },
      "matchAll": { "kind": "method", "parameters": [{ "name": "pattern", "type": "regex|string" }], "returns": "array" },
      "replace": { "kind": "method", "parameters": [{ "name": "oldValue", "type": "string|regex" }, { "name": "newValue", "type": "string" }], "returns": "string" },
      "padLeft": { "kind": "method", "parameters": [{ "name": "width", "type": "number" }, { "name": "padding", "type": "string", "optional": true }], "returns": "string" },
      "padRight": { "kind": "method", "parameters": [{ "name": "width", "type": "number" }, { "name": "padding", "type": "string", "optional": true }], "returns": "string" },
      "trim": { "kind": "method", "parameters": [], "returns": "string" },
      "trimLeft": { "kind": "method", "parameters": [], "returns": "string" },
      "trimRight": { "kind": "method", "parameters": [], "returns": "string" },
      "slice": { "kind": "method", "parameters": [{ "name": "start", "type": "number" }, { "name": "end", "type": "number", "optional": true }], "returns": "string" },
      "toString": { "kind": "method", "parameters": [], "returns": "string" },
      "charCodeAt": { "kind": "method", "parameters": [{ "name": "index", "type": "number" }], "returns": "number" },
      "toLowerCase": { "kind": "method", "parameters": [], "returns": "string" },
      "toUpperCase": { "kind": "method", "parameters": [], "returns": "string" }
    },
    "StringBuffer": {
      "append": { "kind": "method", "parameters": [{ "name": "values", "type": "any", "variadic": true }], "returns": "null" },
      "insert": { "kind": "method", "parameters": [{ "name": "index", "type": "number" }, { "name": "value", "type": "string" }], "returns": "null" },
      "appendLine": { "kind": "method", "parameters": [{ "name": "values", "type": "any", "variadic": true }], "returns": "null" },
      "clear": { "kind": "method", "parameters": [], "returns": "null" },
      "release": { "kind": "method", "parameters": [], "returns": "null" },